{
  "$schema": "../entry.schema.json",
  "id": "vuitton-ss08",
  "title": "Louis Vuitton SS 2008",
  "subtitle": "",
  "year": 2008,
  "season": "SS",
  "images": [
    {
      "src": "THE-LEXICON-ASSETS/vuitton-ss08/vuitton-ss08-01.jpg",
      "hotspots": [
        {
          "x": 50,
          "y": 40,
          "label": "Layered Silk Organza Blouse",
          "description": "The layered silk organza blouse cascades sheer cream fabric over a structured bustier; it operates as both inner and outer garment simultaneously. This material strategy engages with the Marc Jacobs era's signature treatment of monogram codes as graphic system rather than brand identifier. The translucent textile reveals the architectural foundation garment beneath; the cuffs fall loosely past the wrists. The piece asserts the permanent traveler aesthetic that defined LV's commercial dominance through the 2000s."
        }
      ]
    }
  ],
  "tags": {
    "brand": "Louis Vuitton",
    "era": "2000 to 2009; The Global Conglomerate Era",
    "politics": "Techno-Politics & Digital Identities | Body Politics & Corporeal Interventions",
    "theories": "Postmodernism | Aesthetic Philosophy | Identity and Subjectivity",
    "gender": "Womenswear",
    "materials": "Silk Organza | Structured Cotton Canvas | Treated Leather | Monogram Jacquard",
    "geography": "Paris (Chambre Syndicale)",
    "anatomy": "Architectural Shielding and Armour | Monolithic Massing | Suspended Drape",
    "format": "Traditional Runway"
  },
  "notes": {
    "provenance": "Marc Jacobs presented Louis Vuitton's Spring/Summer 2008 collection in October 2007 at the Cour Carrée du Louvre during Paris Fashion Week, staging the show in the round to allow full 360-degree viewing of each look. This collection fell at the midpoint of Jacobs's transformative sixteen-year tenure at the house, by which point he had firmly established Vuitton as the world's most commercially dominant luxury fashion label — an achievement built not on heritage conservation but on the aggressive integration of contemporary art, street culture, and celebrity into the house's monogram codes. The SS 2008 collection extended Jacobs's ongoing dialogue between the house's travelling trunk heritage and the aesthetics of postmodern globalism: clothes designed for a permanent state of transit, engineered for women whose primary habitat is the first-class cabin and the international hotel suite.",
    "strategy": "Jacobs structured the collection around the logic of layered utility: silk organza blouses were worn over structured bustiers; fluid trousers were cut with architectural precision at the hip and cuff; outerwear was constructed with the kind of internal scaffolding more commonly associated with couture. The monogram vocabulary was treated as a graphic system rather than a brand identifier — scaled up, fractured across seams, and dissolved into the surface of fabrics that refused easy legibility. The colour palette of ivory, beige, and warm gold reinforced the idea of the permanent traveller: neutral enough for any context, opulent enough to declare the cost of the ticket.",
    "critique": "The Jacobs era at Vuitton is the definitive case study in what has been theorised as 'luxury's postmodern turn' — the moment at which heritage fashion houses abandoned the pretence of timelessness and embraced the contemporary as a perpetual source of capital. Jacobs's genius was to understand that the monogram itself was already postmodern: a sign system so saturated by global reproduction that its meaning had been emptied and was available for reinscription. Each Vuitton collection under his direction was less a proposal about clothing than an argument about what luxury means at the moment of maximum global proliferation — an argument conducted in materials of extraordinary quality on a stage of extraordinary scale."
  }
}
