{
  "$schema": "../entry.schema.json",
  "id": "sander-ss11",
  "title": "Jil Sander SS 2011",
  "subtitle": "",
  "year": 2011,
  "season": "SS",
  "images": [
    {
      "src": "THE-LEXICON-ASSETS/sander-ss11/sander-ss11-01.jpg"
    }
  ],
  "tags": {
    "brand": "Jil Sander",
    "era": "2010 to 2019; The Digital and Streetwear Pivot",
    "politics": "Body Politics & Corporeal Interventions | Gender Deconstruction & Fluidity",
    "theories": "Minimalism & Reduction | Identity and Subjectivity | Structural Stasis | Aesthetic Philosophy",
    "gender": "Womenswear | Menswear",
    "materials": "Precision-Woven Cotton Poplin | Lacquered Organza | Heavy Silk Faille | Compressed Wool | Bonded Technical Fabrics",
    "geography": "Milan (Camera Nazionale della Moda)",
    "anatomy": "Architectural Shielding and Armour | Monolithic Massing | Scaffolding and Internal Frameworks | Bodily Obfuscation",
    "format": "Traditional Runway"
  },
  "notes": {
    "provenance": "Raf Simons presented his Spring/Summer 2011 collection for Jil Sander in September 2010 at the Fabbrica del Vapore in Milan, in the penultimate phase of his four-year tenure at the house. Simons had joined Jil Sander in 2005 following Sander's departure from her own label, and his work there had produced one of the most sustained critical discourses in contemporary fashion: a series of collections that extended the minimalist vocabulary the founder had established while introducing a psychological intensity and structural ambition that was recognisably Simons's own. The SS 2011 collection was one of the most formally concentrated of his Jil Sander period: a precise investigation of what garments become when all decoration, all ornament, and all reference is systematically eliminated, leaving only construction and material quality as expressive instruments.",
    "strategy": "Simons's structural approach for the collection was the pursuit of geometric purity through tailoring: garments were constructed to maintain their three-dimensional shape independently of the body, using internal scaffolding and compressed interfacing to produce forms that read as architectural volumes rather than clothing. Lacquered organza was engineered to hold precise angles at shoulder and hem; wool suiting was bonded to technical fabric to resist the natural collapse of the weave under its own weight; silk faille was cut to form self-supporting cylindrical sleeves that retained their shape whether worn or not. The colour palette — white, ivory, pale sand, and a single intrusion of acid yellow — forced all attention onto form, eliminating the possibility of colour as a compositional distraction.",
    "critique": "The Simons era at Jil Sander constitutes the most forensically rigorous investigation of minimalism's possibilities and limits in the contemporary fashion archive. His SS 2011 collection poses with particular clarity the central problem of fashion minimalism: if the garment is stripped of all ornamental and referential content, what remains as the carrier of meaning? Simons's answer — consistently across his Jil Sander period — was construction: the precision of the cut, the quality of the material, the degree to which the garment's form is independent of the body wearing it. This is a deeply sculptural proposition that treats the human body not as the garment's primary subject but as one structural variable among several. The collection remains a standard reference for the intellectual possibilities of the reduced silhouette."
  }
}
