{
  "$schema": "../entry.schema.json",
  "id": "van-noten-ss15",
  "title": "Dries Van Noten SS 2015",
  "subtitle": "",
  "year": 2015,
  "season": "SS",
  "images": [
    {
      "src": "THE-LEXICON-ASSETS/van-noten-ss15/van-noten-ss15-01.jpg",
      "hotspots": [
        {
          "x": 50,
          "y": 40,
          "label": "Hand-Painted Silk and Velvet Layered Look",
          "description": "The hand-painted silk and velvet layered look stacks multiple textile traditions into a single garment system; it places a hand-illustrated organza panel over a velvet bodice cut with utilitarian field-jacket precision. This material strategy embodies the archival depth that defined Dries Van Noten's 100th show — accumulation as a slow craft achievement rather than maximalist excess. The competing surface textures resolve into a coherent palette only after sustained looking; each layer cites a specific making tradition. The garment asserts what independent, craft-centered, long-term practice produces when held against the conglomerate luxury system."
        }
      ]
    }
  ],
  "tags": {
    "brand": "Dries Van Noten",
    "era": "2010 to 2019; The Digital and Streetwear Pivot",
    "politics": "Body Politics & Corporeal Interventions | Labour Politics & Industrial Production",
    "theories": "Aesthetic Philosophy | Postmodernism | Identity and Subjectivity",
    "gender": "Womenswear",
    "materials": "Hand-Painted Silk | Embroidered Silk Organza | Velvet | Metallic Brocade | Printed Cotton Muslin",
    "geography": "Paris (Chambre Syndicale)",
    "anatomy": "Suspended Drape | Displaced Anatomy and Padding | Modular Componentry",
    "format": "Theatrical Stage Performance"
  },
  "notes": {
    "provenance": "Dries Van Noten presented his Spring/Summer 2015 collection in October 2014 at the Palais de Justice in Paris, staging it as a celebration of his 100th runway show — a milestone that marked over three decades of continuous presentation in the fashion system without the support of a conglomerate owner, private equity backing, or the commercial infrastructure typically required to sustain a major fashion label. To mark the occasion, Van Noten hosted a dinner for 500 guests — collaborators, craftspeople, muses, and editors who had accompanied the house across its history — at the Hôtel de Ville in Paris the night before the show. The dinner itself was widely documented and considered a statement about the value of long-term creative relationships in an industry increasingly structured around short-term financial cycles. The collection presented the following day extended this theme: it was built from a lifetime of accumulated references, material relationships, and print archives, assembled with a density that could only be achieved over the timescale Van Noten had devoted to it.",
    "strategy": "The collection was structurally organised as a layered archive — each look built from multiple textile traditions, print techniques, and construction methodologies placed in productive dialogue. Hand-painted silk organza was worn over velvet; metallic brocade was cut into utilitarian field-jacket silhouettes; embroidered panels were applied to raw-cotton bases. The colour combinations were characteristically Van Noten: unexpected adjacencies that should conflict but instead resolve into a logic accessible only after sustained looking. The accumulation was not maximalist in the sense of excess but archival in the sense of depth — each layer legible as a specific reference to a specific tradition of making.",
    "critique": "Van Noten's 100th show is the most explicit statement in the contemporary fashion archive of what an independent, craft-centred, long-term practice looks like when held against the conglomerate model that dominates the luxury industry. The collection's meaning is inseparable from its context: 100 shows produced by a single designer, without outside capital, without a fragrance or accessories category to subsidise the runway, without a succession plan dictated by investor return. In this context, the density of the clothes — the accumulation of hand processes, the layers of reference, the weight of material history — reads not as decoration but as argument: evidence that the slow accumulation of knowledge and relationship produces a different kind of object than the fast cycle of conglomerate fashion."
  }
}
