{
  "$schema": "../entry.schema.json",
  "id": "coperni-ss23",
  "title": "Coperni SS 2023",
  "subtitle": "",
  "year": 2023,
  "season": "SS",
  "images": [
    {
      "src": "THE-LEXICON-ASSETS/coperni-ss23/coperni-ss23-01.jpg"
    }
  ],
  "tags": {
    "brand": "Coperni",
    "era": "2020 to Present; The Post-Pandemic and Surrealist Current",
    "politics": "Techno-Politics & Digital Identities | Body Politics & Corporeal Interventions",
    "theories": "Post-Humanism | Surrealism | Aesthetic Philosophy | Object-Oriented Ontology",
    "gender": "Womenswear",
    "materials": "Biospray Polymer | Acetate | Structural Resin | Metallic Mesh | Technical Jersey",
    "geography": "Paris (Chambre Syndicale)",
    "anatomy": "Anatomical Interaction | Prosthetic Extension | Displaced Anatomy and Padding",
    "format": "Theatrical Stage Performance"
  },
  "notes": {
    "provenance": "Sébastien Meyer and Arnaud Vaillant presented Coperni's Spring/Summer 2023 collection in September 2022 at the Palais de Chaillot in Paris, closing the show with one of the most widely documented moments in twenty-first century fashion history. In the finale, model Bella Hadid appeared on the runway in only underwear and heels; two technicians from the Barcelona-based biotechnology company Fabrican then spent approximately ten minutes applying a spray of biodegradable polymer fibres directly onto her body using pressurised canisters. The material — a non-woven fabric developed by Dr. Manel Torres at the Royal College of Art — dried in real time to form a fitted off-white dress that was simultaneously couture in its precision and industrial in its manufacture. The event was filmed, photographed, and shared across global media within hours, generating a scale of cultural attention that no fashion show had achieved since the era of Alexander McQueen's most theatrical presentations.",
    "strategy": "The show's structural strategy positioned technology not as a finish applied to an otherwise conventional garment system but as the primary manufacturing process: the dress that closed the show had no pattern, no seam, no cutter, and no atelier — it was assembled directly on the body in public view. The broader collection reinforced this logic through its treatment of hardware: bag straps were engineered from architectural resin; closures were replaced with magnetic systems; garments were structured using technical mesh derived from aerospace materials. Meyer and Vaillant consistently position Coperni within a tradition of applied science rather than applied craft, sourcing collaborators from research institutions rather than textile mills.",
    "critique": "The Coperni SS 2023 spray-dress finale is the defining fashion spectacle of the post-Instagram era: an event designed for the moving image rather than the still photograph, for sharing rather than for looking, for the immediate emotional hit rather than the sustained critical engagement. Its cultural significance is not diminished by this observation — the capacity to generate a universally legible image of fashion's capacity for transformation is itself a form of power. The dress raises the question that all genuinely technological fashion objects raise: at what point does the technology become the garment, and at what point does it remain a performance conducted on a garment? The Fabrican material produces a textile, and the textile produces a dress — but the process of production is the cultural content, not the object it generates."
  }
}
