{
  "$schema": "../entry.schema.json",
  "id": "raf-simons-aw01",
  "title": "Raf Simons AW 2001",
  "subtitle": "Riot Riot Riot",
  "year": 2001,
  "season": "AW",
  "images": [
    {
      "src": "THE-LEXICON-ASSETS/raf-simons-aw01/raf-simons-aw01-01.jpg"
    }
  ],
  "tags": {
    "brand": "Raf Simons",
    "era": "2000–2009; The Global Conglomerate Era",
    "politics": "Queer Theory & Subcultural Systems | Anti-Consumerism & Institutional Critique | Activism & Crisis Response",
    "theories": "Subcultural Resistance Theory | Hauntology (Fisher) | The Grotesque and Abject | Psychoanalytic Theory (Lacanian)",
    "gender": "Menswear",
    "materials": "Petroleum-Based Polymers | Plant-Based Cellulose | Artificially Degraded Textiles",
    "geography": "Paris (Chambre Syndicale)",
    "anatomy": "Sartorial Restriction | Compressed Proportions | Deconstructed Assembly",
    "format": "Traditional Runway"
  },
  "notes": {
    "provenance": "Raf Simons' AW 2001 collection 'Riot Riot Riot' was presented in Paris and widely regarded as the designer's most radical statement in menswear. The show featured models in tight black silhouettes walking through a deliberately compressed, claustrophobic set, evoking concrete brutalism and youth riot culture. Named in part after Kathleen Hanna's Bikini Kill, the collection drew on youth subculture, post-punk aggression, and the psychological pressure of adolescent identity.",
    "strategy": "Simons compressed garment silhouettes to their absolute minimum — narrow trousers, short jackets, tight knitwear — creating a body-as-projectile aesthetic. The palette was almost exclusively black, punctuated by aggressive graphic prints sourced from punk, industrial music, and protest graphics. Each look was constructed as a uniform of resistance: anonymising, kinetic, and deliberately anti-luxurious.",
    "critique": "Riot Riot Riot functioned as a manifesto for a generation of young men alienated from traditional masculinity and the emerging luxury menswear market. Simons channelled the energy of youth riot culture into a formal language of tailoring, arguing that clothes could carry political charge without explicit slogan or spectacle. The collection established Simons as the defining voice in post-millennium menswear and his influence on contemporary fashion — from Hedi Slimane to Virgil Abloh — remains foundational."
  }
}
